Post ID,Permalink,Post Message,Type,Countries,Languages,Posted,Audience Targeting,Lifetime Post Total Reach,Lifetime Post organic reach,Lifetime Post Paid Reach,Lifetime Post Total Impressions,Lifetime Post Organic Impressions,Lifetime Post Paid Impressions,Lifetime Engaged Users,Lifetime Matched Audience Targeting Consumers on Post,Lifetime Matched Audience Targeting Consumptions on Post,Lifetime Negative Feedback from Users,Lifetime Negative Feedback,Lifetime Post Impressions by people who have liked your Page,Lifetime Post reach by people who like your Page,Lifetime Post Paid Impressions by people who have liked your Page,Lifetime Paid reach of a post by people who like your Page,Lifetime People who have liked your Page and engaged with your post,Lifetime Organic views to 95%,Lifetime Organic views to 95%.1,Lifetime Paid views to 95%,Lifetime Paid views to 95%.1,Lifetime Organic Video Views,Lifetime Organic Video Views.1,Lifetime Paid Video Views,Lifetime Paid Video Views.1,Lifetime Average time video viewed,Lifetime Video length,Lifetime Talking About This (Post) by action type - like,Lifetime Talking About This (Post) by action type - share,Lifetime Talking About This (Post) by action type - comment,Lifetime Post Stories by action type - like,Lifetime Post Stories by action type - share,Lifetime Post Stories by action type - comment,Lifetime Post Audience Targeting Unique Consumptions by Type - video play,Lifetime Post Audience Targeting Unique Consumptions by Type - other clicks,Lifetime Post Audience Targeting Unique Consumptions by Type - link clicks,Lifetime Post Audience Targeting Unique Consumptions by Type - photo view,Lifetime Matched Audience Targeting Consumptions by Type - video play,Lifetime Matched Audience Targeting Consumptions by Type - other clicks,Lifetime Matched Audience Targeting Consumptions by Type - link clicks,Lifetime Matched Audience Targeting Consumptions by Type - photo view,Lifetime Negative Feedback from Users by Type - hide_all_clicks,Lifetime Negative Feedback by Type - hide_all_clicks,Region,Fecha,Hora,Dia,Mes,VTR,E.R.
199643730387838_920917031593834,https://www.facebook.com/NogginBR/posts/920917031593834,"Você procura entretenimento e conteúdo educativo para os seus filhos? Descubra o Noggin, a melhor ferramenta para a etapa pré-escolar, pois é desenvolvido por especialistas dentro de uma plataforma segura e certificada. Baixe agora mesmo!",Video,0.0,0.0,06/29/2019 02:30:00 PM, ,67,67,0,97,97,0,9,8,15,0,0,75,50,0,0,2,12,13,0,0,35,40,0,0,5837,15699,2.0,0.0,0.0,2.0,0.0,0.0,7.0,5.0,0.0,0.0,9.0,6.0,0.0,0.0,0.0,0.0,Brasil,2019-06-29,14,Sábado,6,0.5223880597014925,0.1044776119402985
199643730387838_920915234927347,https://www.facebook.com/NogginBR/posts/920915234927347,"Todos os meses o nosso app é abastecido com novos especiais e séries, incluindo temporadas completas dos desenhos mais legais do Nick Jr. Faça o download do app para que seus filhos comecem a curtir agora mesmo!",Video,0.0,0.0,06/28/2019 04:31:43 PM, ,608,608,0,812,812,0,24,12,18,0,0,101,62,0,0,4,28,28,0,0,97,108,0,0,4215,24190,11.0,3.0,4.0,12.0,3.0,8.0,11.0,6.0,0.0,0.0,12.0,6.0,0.0,0.0,0.0,0.0,Brasil,2019-06-28,16,Viernes,6,0.15953947368421054,0.039473684210526314
199643730387838_915598268792377,https://www.facebook.com/NogginBR/posts/915598268792377,"As melhores séries do Nick Jr. com jogos e músicas desenvolvidos por especialistas dentro de uma plataforma segura e sem comerciais, isso é o Noggin. Baixe o app para aproveitar todos os seus benefícios.",Video,0.0,0.0,06/25/2019 07:45:00 AM, ,114,114,0,184,184,0,5,5,7,0,0,148,93,0,0,2,5,7,0,0,37,50,0,0,4074,24467,1.0,0.0,1.0,1.0,0.0,1.0,3.0,3.0,0.0,0.0,3.0,4.0,0.0,0.0,0.0,0.0,Brasil,2019-06-25,7,Martes,6,0.32456140350877194,0.043859649122807015
199643730387838_915602292125308,https://www.facebook.com/NogginBR/posts/915602292125308,Agora os seus pequenos poderão se unir às nossas heroínas multicoloridas em grandes aventuras! 🌎🌱. Baixe o app para curtir Rainbow Rangers em família!,Video,0.0,0.0,06/22/2019 10:00:01 AM, ,483,483,0,664,664,0,20,11,16,0,0,117,67,0,0,5,19,20,0,0,74,88,0,0,4731,41705,9.0,3.0,1.0,10.0,3.0,1.0,6.0,7.0,0.0,0.0,8.0,8.0,0.0,0.0,0.0,0.0,Brasil,2019-06-22,10,Sábado,6,0.15320910973084886,0.041407867494824016
199643730387838_911245355894335,https://www.facebook.com/NogginBR/posts/911245355894335,Uma plataforma de streaming on demand para crianças pré-escolares. Esse é o serviço que prestamos a milhares de famílias que procuram conteúdos digitais seguros para os pequenos da casa. Baixe o app 👉📱https://goo.gl/A8pm8K iOS: https://goo.gl/obGlp5,Video,0.0,0.0,06/15/2019 01:24:00 PM, ,127114,359,126673,236217,511,235706,234,217,281,0,0,535,227,444,182,9,24,28,740,910,70,80,26478,33294,2609,15145,15.0,1.0,4.0,19.0,1.0,9.0,85.0,72.0,65.0,0.0,135.0,80.0,66.0,0.0,0.0,0.0,Brasil,2019-06-15,13,Sábado,6,0.0005506867850905487,0.0012351117894173734
199643730387838_910574282628109,https://www.facebook.com/NogginBR/posts/910574282628109,"As fortalezas e os talentos específicos de seus personagens ganham protagonismo em Rainbow Rangers, uma série que celebra a singularidade, inclusive quando mostra como as diferenças contribuem para fortalecer uma equipe 💛💙💚🧡💜. Baixe o app para os seus pequenos assistirem off-line!",Video,0.0,0.0,06/14/2019 03:57:05 PM, ,55,55,0,75,75,0,7,6,9,0,0,52,35,0,0,1,10,10,0,0,23,28,0,0,6566,18814,1.0,0.0,0.0,1.0,0.0,0.0,5.0,2.0,0.0,0.0,7.0,2.0,0.0,0.0,0.0,0.0,Brasil,2019-06-14,15,Viernes,6,0.41818181818181815,0.05454545454545454
199643730387838_906088426410028,https://www.facebook.com/NogginBR/posts/906088426410028,"Duas opções que celebram as diferenças e o trabalho em equipe: nossa trupe favorita de cachorros, a Patrulha Canina, e a nova equipe de salva-vidas multicolorida, Rainbow Rangers. Qual dos dois o seu pequeno vai querer ver? O link para fazer o download do app está no nosso perfil.",Video,0.0,0.0,06/08/2019 02:50:25 PM, ,425,425,0,587,587,0,272,261,359,0,0,112,67,0,0,5,210,260,0,0,341,429,0,0,17058,17577,12.0,3.0,1.0,14.0,3.0,2.0,258.0,10.0,0.0,0.0,347.0,12.0,0.0,0.0,0.0,0.0,Brasil,2019-06-08,14,Sábado,6,0.8023529411764706,0.0611764705882353
199643730387838_905390936479777,https://www.facebook.com/NogginBR/posts/905390936479777,"O melhor do nosso MEGA LANÇAMENTO, Rainbow Rangers 🌈? Cada uma das Rangers tem um talento único que empresta à equipe, não apenas para resgatar, mas também para ampliar a empatia e a compaixão. Se você ainda não tem o Noggin, baixe o app agora mesmo! 👉📱Android: https://goo.gl/A8pm8K iOS: https://goo.gl/obGlp5",Video,0.0,0.0,06/07/2019 04:05:28 PM, ,90,90,0,113,113,0,13,10,15,0,0,87,69,0,0,5,5,6,0,0,29,33,0,0,7868,35305,2.0,1.0,0.0,2.0,1.0,0.0,9.0,3.0,0.0,0.0,11.0,4.0,0.0,0.0,0.0,0.0,Brasil,2019-06-07,16,Viernes,6,0.32222222222222224,0.06666666666666667
199643730387838_902305730121631,https://www.facebook.com/NogginBR/posts/902305730121631,"Nós temos os melhores programas do Nick Jr., jogos e especiais para que os seus pequenos aprendam enquanto se divertem. Baixe já!",Video,0.0,0.0,06/03/2019 01:15:46 PM, ,99,99,0,134,134,0,8,5,5,0,0,108,78,0,0,4,7,7,0,0,36,36,0,0,4667,19015,3.0,1.0,0.0,3.0,1.0,0.0,1.0,4.0,0.0,0.0,1.0,4.0,0.0,0.0,0.0,0.0,Brasil,2019-06-03,13,Lunes,6,0.36363636363636365,0.08080808080808081
199643730387838_902299483455589,https://www.facebook.com/NogginBR/posts/902299483455589,"A segurança do seu filho é a nossa prioridade. Sem comerciais e com uma plataforma certificada, nós garantimos a sua proteção.",Video,0.0,0.0,06/03/2019 01:01:11 PM, ,100,100,0,132,132,0,4,2,2,0,0,105,81,0,0,3,3,3,0,0,17,17,0,0,3922,28512,2.0,1.0,0.0,2.0,1.0,0.0,0.0,2.0,0.0,0.0,0.0,2.0,0.0,0.0,0.0,0.0,Brasil,2019-06-03,13,Lunes,6,0.17,0.05
199643730387838_367896447168469,https://www.facebook.com/NogginBR/videos/367896447168469/,0,Video,0.0,0.0,06/01/2019 10:17:27 AM, ,154,154,0,213,213,0,64,57,84,0,0,9,7,0,0,7,16,31,0,0,78,117,0,0,34643,34643,5.0,2.0,1.0,6.0,2.0,1.0,57.0,0.0,0.0,0.0,84.0,0.0,0.0,0.0,0.0,0.0,Brasil,2019-06-01,10,Sábado,6,0.5064935064935064,0.05194805194805195
199643730387838_900764166942454,https://www.facebook.com/NogginBR/posts/900764270275777:0,Noggin BR,Photo,0.0,0.0,06/01/2019 10:00:04 AM, ,1,1,0,1,1,0,5,0,0,0,0,1,1,0,0,4,0,0,0,0,0,0,0,0,0,0,4.0,1.0,0.0,4.0,1.0,0.0,0.0,0.0,0.0,0.0,0.0,0.0,0.0,0.0,0.0,0.0,Brasil,2019-06-01,10,Sábado,6,0.0,5.0
199643730387838_893577870994417,https://www.facebook.com/NogginBR/posts/893577870994417,"Todos os meses temos alguma novidade no app do Noggin. De temporadas completas a estreias de séries, músicas e jogos: as surpresas não param nunca! Faça o download do app e curta com os seus pequenos uma nova forma de interagir e aprender online.",Video,0.0,0.0,05/31/2019 07:30:00 AM, ,390,390,0,531,531,0,19,15,26,0,0,86,55,0,0,4,41,47,0,0,72,84,0,0,3933,8810,3.0,2.0,0.0,3.0,2.0,0.0,12.0,9.0,0.0,0.0,15.0,11.0,0.0,0.0,0.0,0.0,Brasil,2019-05-31,7,Viernes,5,0.18461538461538463,0.035897435897435895
199643730387838_895112867507584,https://www.facebook.com/NogginBR/posts/895112867507584,Maio é o mês para agradecer os cuidados da mamãe e por isso temos um especial incrível para você curtir com os pequenos. Acesse esse presente clicando no link do post e baixe o app para celebrar em família! 👉📱https://goo.gl/A8pm8K iOS: https://goo.gl/obGlp5,Photo,0.0,0.0,05/24/2019 12:47:13 PM, ,302,302,0,373,373,0,12,6,9,0,0,351,281,0,0,9,0,0,0,0,0,0,0,0,0,0,6.0,1.0,0.0,6.0,1.0,0.0,0.0,2.0,2.0,3.0,0.0,4.0,2.0,3.0,0.0,0.0,Brasil,2019-05-24,12,Viernes,5,0.0,0.03642384105960265
199643730387838_893030457715825,https://www.facebook.com/NogginBR/posts/893030457715825,"A segurança do seu filho é a nossa prioridade. Sem comerciais e com uma plataforma certificada, nós garantimos a sua proteção! 👊",Video,0.0,0.0,05/21/2019 10:05:00 AM, ,75804,441,75472,195422,598,194824,516,479,622,0,0,568,310,425,226,7,11,12,2954,3651,56,66,15589,25313,3244,28435,42.0,3.0,3.0,47.0,3.0,11.0,450.0,32.0,0.0,0.0,584.0,38.0,0.0,0.0,0.0,0.0,Brasil,2019-05-21,10,Martes,5,0.0007387472956572212,0.0010553532795103161
199643730387838_890373977981473,https://www.facebook.com/NogginBR/posts/890373977981473,"Nós temos os melhores programas do Nick Jr., jogos e especiais para que os seus pequenos aprendam enquanto se divertem. Baixe já o Noggin!",Video,0.0,0.0,05/17/2019 04:15:15 PM, ,92490,724,91821,158088,961,157127,1483,1307,1872,1,1,514,291,405,223,11,25,30,12319,13698,99,116,36399,44920,5098,18837,181.0,25.0,5.0,188.0,25.0,16.0,583.0,41.0,778.0,0.0,1023.0,52.0,797.0,0.0,1.0,1.0,Brasil,2019-05-17,16,Viernes,5,0.0010703859876743432,0.01113633906368256
199643730387838_886209188397952,https://www.facebook.com/NogginBR/posts/886209188397952,"A importância de participar e ajudar a nossa comunidade e amigos 🤝 é a mensagem mais importante de ☀️ Sunny Day, nossa super estreia do mês. Baixe o app para curtir com o seu pequeno! 😀",Video,0.0,0.0,05/12/2019 07:37:00 AM, ,100,100,0,138,138,0,14,11,12,0,0,100,71,0,0,6,9,10,0,0,26,37,0,0,8853,18366,4.0,1.0,0.0,5.0,1.0,0.0,8.0,3.0,0.0,0.0,9.0,3.0,0.0,0.0,0.0,0.0,Brasil,2019-05-12,7,Domingo,5,0.26,0.08
199643730387838_885209668497904,https://www.facebook.com/NogginBR/posts/885209668497904,Sunny Day é dona de um salão de beleza 💇 e resolve qualquer problema 💁🏾 com seu talento. A personagem é um exemplo positivo de como se manter fiel à própria vocação. A criançada da sua casa não pode perder o nosso lançamento do mês!,Video,0.0,0.0,05/11/2019 01:30:00 PM, ,220,220,0,348,348,0,104,98,131,0,0,175,116,0,0,8,74,96,0,0,160,207,0,0,22308,35305,8.0,3.0,2.0,8.0,3.0,4.0,93.0,13.0,0.0,0.0,117.0,14.0,0.0,0.0,0.0,0.0,Brasil,2019-05-11,13,Sábado,5,0.7272727272727273,0.11818181818181818
199643730387838_292566431655062,https://www.facebook.com/NogginBR/videos/292566431655062/,0,Video,0.0,0.0,05/08/2019 01:18:45 PM, ,32,32,0,49,49,0,33,32,51,0,0,14,7,0,0,7,12,22,0,0,29,62,0,0,30377,30377,1.0,1.0,0.0,1.0,1.0,0.0,32.0,1.0,0.0,0.0,50.0,1.0,0.0,0.0,0.0,0.0,Brasil,2019-05-08,13,Miércoles,5,0.90625,0.09375
199643730387838_881197475565790,https://www.facebook.com/NogginBR/posts/881197475565790,"Além do fator bilíngue, todas as temporadas de Dora A Aventureira trabalham o sentido de direção ↔️ através de mapas 🗺️, pistas e desafios criados para os pré-escolares. Faça o download do app 📲 para o seu pequeno aprender e se divertir com a Dora e o Mapa onde, quando e quantas vezes quiser!",Video,0.0,0.0,05/04/2019 11:23:45 AM, ,534,534,0,727,727,0,31,25,39,0,0,150,89,0,0,4,22,22,0,0,74,91,0,0,5263,24595,3.0,4.0,2.0,5.0,4.0,3.0,14.0,15.0,0.0,0.0,20.0,19.0,0.0,0.0,0.0,0.0,Brasil,2019-05-04,11,Sábado,5,0.13857677902621723,0.0449438202247191
199643730387838_880044089014462,https://www.facebook.com/NogginBR/posts/880044089014462,"Dora tem uma atitude proativa e também é reflexiva e paciente, já que muitas vezes decide &quot;parar e pensar&quot; em um problema quando não consegue resolvê-lo de imediato. Não percam a NOVA TEMPORADA COMPLETA de Dora, A Aventureira. Baixe o app para curtir com o seu pequeno!",Video,0.0,0.0,05/02/2019 04:37:41 PM, ,127,127,0,187,187,0,68,64,80,0,0,115,76,0,0,2,42,48,0,0,83,98,0,0,10778,17257,3.0,3.0,0.0,3.0,3.0,0.0,63.0,5.0,0.0,0.0,75.0,5.0,0.0,0.0,0.0,0.0,Brasil,2019-05-02,16,Jueves,5,0.6535433070866141,0.08661417322834646
199643730387838_876107642741440,https://www.facebook.com/NogginBR/posts/876107642741440,"Pode ter certeza de que o Noggin coloca à sua disposição os melhores programas do Nick Jr. com uma atualização mensal, incluindo super lançamentos e especiais para que o seu pequeno aprenda enquanto se diverte. Baixe agora mesmo! Android ➡️ https://goo.gl/A8pm8K iOS ➡️ https://goo.gl/obGlp5",Video,0.0,0.0,04/27/2019 01:00:00 PM, ,473,473,0,646,646,0,14,12,18,0,0,125,83,0,0,4,16,18,0,0,55,62,0,0,4476,24190,3.0,2.0,0.0,5.0,3.0,0.0,9.0,5.0,0.0,0.0,10.0,8.0,0.0,0.0,0.0,0.0,Brasil,2019-04-27,13,Sábado,4,0.11627906976744186,0.021141649048625793
199643730387838_876106479408223,https://www.facebook.com/NogginBR/posts/876106479408223,"O Noggin é 100% pensado para o bem-estar 🤗 dos pequenos. Com conteúdo criado por especialistas 👨🏾‍🏫 e uma plataforma fechada 🔐, somos um jeito seguro de monitorar 👀 a informação digital que seus filhos consomem #protejasuacrianca Android ➡️ https://goo.gl/A8pm8K iOS ➡️ https://goo.gl/obGlp5",Video,0.0,0.0,04/26/2019 02:57:44 PM, ,191,191,0,245,245,0,8,4,5,0,0,92,71,0,0,2,7,9,0,0,28,37,0,0,2972,13694,4.0,2.0,0.0,4.0,2.0,0.0,2.0,2.0,0.0,0.0,3.0,2.0,0.0,0.0,0.0,0.0,Brasil,2019-04-26,14,Viernes,4,0.14659685863874344,0.041884816753926704
199643730387838_870043650014506,https://www.facebook.com/NogginBR/posts/870043650014506,"Quais valores Nella, Uma Princesa Corajosa comunica para as crianças? A auto-confiança e a inclusão. Que o importante não é ganhar, mas sim aproveitar o processo que permite superar os diferentes obstáculos que se apresentam. Link em nossa bio para você baixar o app no seu dispositivo 👉📱",Video,0.0,0.0,04/20/2019 04:31:00 PM, ,227,227,0,310,310,0,12,8,12,0,0,257,191,0,0,6,18,21,0,0,42,56,0,0,7635,18387,4.0,2.0,2.0,5.0,2.0,2.0,7.0,2.0,0.0,0.0,9.0,3.0,0.0,0.0,0.0,0.0,Brasil,2019-04-20,16,Sábado,4,0.18502202643171806,0.04405286343612335
199643730387838_870036846681853,https://www.facebook.com/NogginBR/posts/870036846681853,Em busca de entretenimento educativo para o seu pequeno? Rusty Rivets apresenta as técnicas básicas do processo de engenharia de forma lúdica para pré-escolares. Na medida ideal para semear interesse e curiosidade. Baixe o Noggin e curta as melhores séries do Nick Jr. sem publicidade! Android: https://goo.gl/A8pm8K iOS: https://goo.gl/obGlp5,Video,0.0,0.0,04/19/2019 10:00:00 AM, ,353,353,0,441,441,0,16,10,14,0,0,120,98,0,0,2,15,16,0,0,58,70,0,0,3702,17214,4.0,3.0,1.0,5.0,3.0,1.0,8.0,2.0,0.0,0.0,12.0,2.0,0.0,0.0,0.0,0.0,Brasil,2019-04-19,10,Viernes,4,0.1643059490084986,0.028328611898016998
199643730387838_867703946915143,https://www.facebook.com/NogginBR/posts/867703946915143,"A Semana Santa chegou e com ela, o especial Contos de Páscoa! Blaze, Patrulha Canina e Team Umizoomi precisam da ajuda dos seus filhos para encontrar os ovos de páscoa e outras surpresas. Baixe o Noggin e obtenha 7 dias grátis! Android: https://goo.gl/A8pm8K iOS: https://goo.gl/obGlp5",Video,0.0,0.0,04/14/2019 07:05:00 AM, ,490,490,0,694,694,0,22,11,12,0,0,152,87,0,0,4,23,25,0,0,58,70,0,0,4176,15635,9.0,2.0,3.0,11.0,3.0,5.0,10.0,2.0,0.0,0.0,10.0,2.0,0.0,0.0,0.0,0.0,Brasil,2019-04-14,7,Domingo,4,0.11836734693877551,0.0326530612244898
199643730387838_866802820338589,https://www.facebook.com/NogginBR/posts/866802820338589,"Nella é uma princesa tradicional que se dedica a atividades reais, mas se transforma quando ela ou seus amigos se encontram em problemas. A mensagem de “Nella, Uma Princesa Corajosa” é excelente para crianças, porque lhes transmite que não somos definidos por nossa aparência, mas sim pelo que acreditamos que podemos ser e fazer.",Video,0.0,0.0,04/12/2019 11:59:02 AM, ,577,577,0,796,796,0,31,25,29,0,0,191,124,0,0,6,29,31,0,0,69,82,0,0,5547,15379,6.0,3.0,3.0,8.0,4.0,5.0,25.0,0.0,0.0,0.0,29.0,0.0,0.0,0.0,0.0,0.0,Brasil,2019-04-12,11,Viernes,4,0.1195840554592721,0.02079722703639515
199643730387838_862309947454543,https://www.facebook.com/NogginBR/posts/862309947454543,"Chegou “Nella, Uma Princesa Corajosa”, o mega lançamento do mês, a série que transformará o mundo das princesas para sempre 👑🗡💖🛡. Faça o download do Noggin para que a criançada da sua casa possa curtir esse e outros programas do Nick Jr, off-line e sem comerciais! 🤳Android: https://goo.gl/A8pm8K iOS: https://goo.gl/obGlp5",Video,0.0,0.0,04/05/2019 01:53:10 PM, ,537,537,0,724,724,0,51,46,57,0,0,107,60,0,0,4,39,42,0,0,105,125,0,0,7022,30633,6.0,3.0,2.0,9.0,5.0,3.0,39.0,8.0,0.0,0.0,45.0,12.0,0.0,0.0,0.0,0.0,Brasil,2019-04-05,13,Viernes,4,0.19553072625698323,0.035381750465549346
199643730387838_861682524183952,https://www.facebook.com/NogginBR/posts/861682524183952,"Temos mais uma temporada de 🐾 Pistas de Blue, o programa que revolucionou o gênero de série animada educativa, ao estimular a participação de seus espectadores. Baixe o app para que seus pequenos assistam e encontrem as pistas... com Blue! 🐾",Video,0.0,0.0,04/04/2019 02:39:47 PM, ,91,91,0,143,143,0,37,35,43,0,0,94,60,0,0,6,19,19,0,0,50,64,0,0,9329,18643,5.0,1.0,1.0,6.0,1.0,1.0,33.0,5.0,0.0,0.0,38.0,5.0,0.0,0.0,0.0,0.0,Brasil,2019-04-04,14,Jueves,4,0.5494505494505495,0.13186813186813187
199643730387838_2128005950628989,https://www.facebook.com/NogginBR/videos/2128005950628989/,0,Video,0.0,0.0,04/01/2019 03:57:42 PM, ,40,40,0,67,67,0,53,51,94,0,0,9,7,0,0,9,14,34,0,0,46,95,0,0,30547,30547,3.0,1.0,0.0,3.0,1.0,0.0,50.0,1.0,0.0,0.0,93.0,1.0,0.0,0.0,0.0,0.0,Brasil,2019-04-01,15,Lunes,4,1.15,0.125
199643730387838_859846127700925,https://www.facebook.com/NogginBR/posts/859846207700917:0,Noggin BR,Photo,0.0,0.0,04/01/2019 03:51:27 PM, ,123,123,0,165,165,0,14,1,1,0,0,3,2,0,0,6,0,0,0,0,0,0,0,0,0,0,13.0,2.0,0.0,13.0,2.0,0.0,0.0,0.0,0.0,1.0,0.0,0.0,0.0,1.0,0.0,0.0,Brasil,2019-04-01,15,Lunes,4,0.0,0.12195121951219512
199643730387838_858488464503358,https://www.facebook.com/NogginBR/posts/858488464503358,"Situações familiares e muuuuuitas choco músicas para dançar 💃🏽 com a criançada: tudo isso e muito mais você encontra na nossa nova série, 🍫Os Chocolix. Não fiquem de fora! Baixe já o Noggin! Android: https://goo.gl/A8pm8K iOS: https://goo.gl/obGlp5",Video,0.0,0.0,03/30/2019 12:49:01 PM, ,144,144,0,185,185,0,8,5,5,0,0,137,111,0,0,2,4,5,0,0,19,23,0,0,5346,56297,4.0,1.0,0.0,4.0,1.0,0.0,4.0,1.0,0.0,0.0,4.0,1.0,0.0,0.0,0.0,0.0,Brasil,2019-03-30,12,Sábado,3,0.13194444444444445,0.041666666666666664
199643730387838_857894964562708,https://www.facebook.com/NogginBR/posts/857894964562708,Aprendizagens e aventuras são a especialidade da Patrulha Canina + Blaze and the Monster Machines. Muitas lições de STEM e desenvolvimento social esperam pela criançada no Noggin. Aproveite os 7 dias grátis e baixe o app agora mesmo! Android: https://goo.gl/A8pm8K iOS: https://goo.gl/obGlp5,Video,0.0,0.0,03/29/2019 03:53:04 PM, ,180,180,0,258,258,0,486,479,794,0,0,107,81,0,0,4,440,672,0,0,475,765,0,0,9983,9983,19.0,3.0,0.0,22.0,3.0,0.0,479.0,9.0,0.0,0.0,785.0,9.0,0.0,0.0,0.0,0.0,Brasil,2019-03-29,15,Viernes,3,2.638888888888889,0.17222222222222222
199643730387838_854094008276137,https://www.facebook.com/NogginBR/posts/854094008276137,"É hora da sobremesa! O seu pequeno poderá curtir Chocolix, o programa mais doce e familiar do Nick Jr., onde e quando quiser, sem comerciais! Faça o download do Noggin agora! Android: https://goo.gl/A8pm8K iOS: https://goo.gl/obGlp5",Video,0.0,0.0,03/23/2019 04:03:00 PM, ,122,122,0,174,174,0,11,8,11,0,0,125,89,0,0,5,8,9,0,0,21,32,0,0,4409,12478,4.0,1.0,1.0,4.0,1.0,1.0,6.0,2.0,0.0,0.0,9.0,2.0,0.0,0.0,0.0,0.0,Brasil,2019-03-23,16,Sábado,3,0.1721311475409836,0.06557377049180328
199643730387838_853485571670314,https://www.facebook.com/NogginBR/posts/853485571670314,"Com altas expectativas, iniciativa e proatividade, a personagem #Skye 🐶da Patrulha Canina é um modelo a seguir para milhares de meninas. Encontre os especiais da #PatrulhaCanina no Noggin. Baixe já o nosso app! Android: https://goo.gl/A8pm8K iOS: https://goo.gl/obGlp5",Video,0.0,0.0,03/22/2019 02:52:55 PM, ,76,76,0,116,116,0,6,5,10,0,0,76,50,0,0,2,7,9,0,0,21,33,0,0,7829,26345,2.0,1.0,0.0,2.0,1.0,0.0,4.0,1.0,0.0,0.0,9.0,1.0,0.0,0.0,0.0,0.0,Brasil,2019-03-22,14,Viernes,3,0.27631578947368424,0.05263157894736842
199643730387838_849676728717865,https://www.facebook.com/NogginBR/posts/849676728717865,No Noggin tem entretenimento que ensina: a Patrulha Canina e Blaze and the Monster Machines com seu dinamismo e formato interativo transmitem ao seu pequen@ lições de tecnologia e ciências. Assine agora! Android: https://goo.gl/A8pm8K iOS: https://goo.gl/obGlp5,Video,0.0,0.0,03/16/2019 03:16:27 PM, ,214,214,0,299,299,0,568,564,799,0,0,152,114,0,0,9,485,635,0,0,583,803,0,0,13459,13459,12.0,1.0,2.0,13.0,1.0,2.0,557.0,9.0,0.0,0.0,790.0,9.0,0.0,0.0,0.0,0.0,Brasil,2019-03-16,15,Sábado,3,2.7242990654205608,0.11214953271028037
199643730387838_849071685445036,https://www.facebook.com/NogginBR/posts/849071685445036,Nós temos novidades achocolatadas...Baixe o app para curtir novos sabores e aventuras! &gt;&gt;&gt; www.noggin.com.br/br,Video,0.0,0.0,03/15/2019 04:00:40 PM, ,664,664,0,926,926,0,32,21,29,0,0,121,67,0,0,7,16,20,0,0,119,139,0,0,3444,22526,11.0,4.0,3.0,11.0,4.0,5.0,11.0,11.0,0.0,0.0,15.0,13.0,0.0,0.0,0.0,0.0,Brasil,2019-03-15,16,Viernes,3,0.17921686746987953,0.043674698795180725
199643730387838_845588559126682,https://www.facebook.com/NogginBR/posts/845588559126682,"Noggin é a plataforma com os programas mais apaixonantes e surpreendentes que seus filhos esperam descobrir. Do início ao fim, 🎤 você e a criançada não conseguirão parar de 🎶 cantar! O que você está esperando para baixar o app?",Video,0.0,0.0,03/09/2019 03:55:23 PM, ,11664,11664,0,21237,21235,0,5159,5123,11144,1,1,325,220,0,0,21,2707,3456,0,0,5437,7882,0,0,26605,40489,128.0,8.0,9.0,173.0,8.0,17.0,4902.0,2892.0,0.0,0.0,7465.0,3673.0,0.0,0.0,1.0,1.0,Brasil,2019-03-09,15,Sábado,3,0.46613511659807955,0.26037379972565156
199643730387838_844976509187887,https://www.facebook.com/NogginBR/posts/844976509187887,Um app de streaming para que seus pequenos possam curtir Blaze and the Monster Machines + o melhor do Nick Jr. sem comerciais? Assine já! Android ↪️ https://goo.gl/A8pm8K iOS ↪️ https://goo.gl/obGlp5O,Video,0.0,0.0,03/08/2019 03:18:26 PM, ,608,608,0,848,848,0,596,588,950,1,1,242,166,0,0,15,254,342,0,0,619,928,0,0,55414,96105,17.0,2.0,3.0,21.0,2.0,10.0,576.0,41.0,0.0,0.0,899.0,51.0,0.0,0.0,1.0,1.0,Brasil,2019-03-08,15,Viernes,3,1.018092105263158,0.10361842105263158
199643730387838_2132083717101629,https://www.facebook.com/NogginBR/videos/2132083717101629/,0,Video,0.0,0.0,03/03/2019 07:19:40 PM, ,32,32,0,51,51,0,33,32,61,0,0,16,9,0,0,9,9,20,0,0,32,70,0,0,30099,30099,2.0,1.0,0.0,2.0,1.0,0.0,32.0,0.0,0.0,0.0,61.0,0.0,0.0,0.0,0.0,0.0,Brasil,2019-03-03,19,Domingo,3,1.0,0.09375
199643730387838_841917849493753,https://www.facebook.com/NogginBR/posts/841917936160411:0,Noggin BR,Photo,0.0,0.0,03/03/2019 03:23:00 PM, ,12,12,0,16,16,0,5,0,0,0,0,1,1,0,0,3,0,0,0,0,0,0,0,0,0,0,5.0,1.0,0.0,5.0,1.0,0.0,0.0,0.0,0.0,0.0,0.0,0.0,0.0,0.0,0.0,0.0,Brasil,2019-03-03,15,Domingo,3,0.0,0.5
199643730387838_840539102964961,https://www.facebook.com/NogginBR/posts/840539102964961,"Eles não são só os umi-amigos dos seus filhos. O Team Umizoomi também os ajuda a resolver problemas matemáticos 🧮💯 através de seu formato interativo. O entretenimento que ensina você só encontra no Noggin, o app do Nick Jr. Faça o download na App Store e no Google Play! ↪️ https://www.noggin.com.br/br/",Video,0.0,0.0,03/01/2019 09:56:51 AM, ,603,603,0,820,820,0,22,15,37,0,0,158,100,0,0,5,11,13,0,0,97,128,0,0,4884,28542,6.0,3.0,2.0,7.0,4.0,2.0,8.0,11.0,0.0,0.0,18.0,19.0,0.0,0.0,0.0,0.0,Brasil,2019-03-01,9,Viernes,3,0.16086235489220563,0.03648424543946932
905878352825130_2279754628770822,https://www.facebook.com/NogginLA/posts/2279754628770822,"¿En busca de entretenimiento y contenido educativo para tu peque? ¡Lo encontraste! Noggin es la mejor herramienta para la etapa preescolar, porque nuestro contenido es desarrollado por expertos dentro de una plataforma segura y certificada. ¡Descárgala ya!",Video,0.0,0.0,06/29/2019 07:00:02 AM, ,275,275,0,367,367,0,31,28,42,0,0,267,203,0,0,6,34,36,0,0,89,97,0,0,5185,15337,3.0,0.0,0.0,3.0,0.0,0.0,23.0,17.0,0.0,0.0,24.0,18.0,0.0,0.0,0.0,0.0,Latinoamérica,2019-06-29,7,Sábado,6,0.3236363636363636,0.07272727272727272
905878352825130_2279717605441191,https://www.facebook.com/NogginLA/posts/2279717605441191,"¿Puedes comunicarte con emojis? Muéstranos en los comentarios. Con Noggin todos los meses encontrarás especiales y series nuevas dentro de nuestra app, incluso temporadas enteras de varias series de Nick Jr. ¡Descárgala y disfruta ya!",Video,0.0,0.0,06/28/2019 07:00:02 AM, ,316,316,0,398,398,0,47,43,77,0,0,312,253,0,0,10,46,55,0,0,123,138,0,0,9265,24190,4.0,0.0,0.0,4.0,0.0,0.0,37.0,29.0,0.0,0.0,43.0,34.0,0.0,0.0,0.0,0.0,Latinoamérica,2019-06-28,7,Viernes,6,0.38924050632911394,0.10443037974683544
905878352825130_2274565079289777,https://www.facebook.com/NogginLA/posts/2274565079289777,¿Qué es Noggin? Una plataforma segura y sin comerciales con las mejores series de Nick Jr. con juegos y canciones desarrollados por expertos. Descárgala para disfrutar de sus beneficios.,Video,0.0,0.0,06/25/2019 07:00:01 AM, ,87881,535,87109,202006,686,201320,526,488,688,0,0,3608,1382,3058,988,16,15,15,2234,2709,97,110,22621,30083,3174,24467,43.0,4.0,1.0,43.0,4.0,1.0,451.0,39.0,0.0,0.0,646.0,42.0,0.0,0.0,0.0,0.0,Latinoamérica,2019-06-25,7,Martes,6,0.0011037653190109353,0.000989975079937643
905878352825130_2269069103172708,https://www.facebook.com/NogginLA/posts/2269069103172708,¡Ahora tu peque podrá unirse a nuestras heroínas multicolor en grandes aventuras! 🌎🌱 ¡Descárgate la app para disfrutar con tu peque de Rainbow Rangers!,Video,0.0,0.0,06/22/2019 06:00:01 AM, ,310,310,0,395,395,0,58,56,81,1,2,271,216,0,0,8,42,50,0,0,110,130,0,0,10793,41705,5.0,1.0,0.0,6.0,1.0,0.0,51.0,22.0,0.0,0.0,58.0,23.0,0.0,0.0,2.0,1.0,Latinoamérica,2019-06-22,6,Sábado,6,0.3548387096774194,0.09032258064516129
905878352825130_2256699621076323,https://www.facebook.com/NogginLA/posts/2256699621076323,Una plataforma de streaming on demand para preescolares. Ese es el servicio que prestamos a miles de familias que buscan contenidos digitales seguros para los más peques de casa. Descarga la app 👉📱https://goo.gl/A8pm8K iOS: https://goo.gl/obGlp5,Video,0.0,0.0,06/15/2019 07:00:37 AM, ,369,369,0,465,465,0,41,39,60,0,0,294,241,0,0,10,35,37,0,0,97,106,0,0,6052,15145,4.0,1.0,0.0,4.0,1.0,0.0,30.0,24.0,1.0,0.0,33.0,26.0,1.0,0.0,0.0,0.0,Latinoamérica,2019-06-15,7,Sábado,6,0.26287262872628725,0.08130081300813008
905878352825130_2257157257697226,https://www.facebook.com/NogginLA/posts/2257157257697226,"No te pierdas de nuestro MEGA estreno Rainbow Rangers, una serie que celebra la singularidad y las diferencias de un equipo 💛💙💚🧡💜 ¡Descarga la app para verla offline!",Video,0.0,0.0,06/14/2019 07:40:57 PM, ,310,310,0,394,395,0,29,27,44,0,0,283,224,0,0,2,34,36,0,0,90,95,0,0,6294,18814,3.0,0.0,0.0,3.0,0.0,0.0,24.0,16.0,0.0,0.0,27.0,17.0,0.0,0.0,0.0,0.0,Latinoamérica,2019-06-14,19,Viernes,6,0.2903225806451613,0.06129032258064516
905878352825130_2240430762703209,https://www.facebook.com/NogginLA/posts/2240430762703209,En Noggin tenemos dos opciones que celebran las diferencias y el trabajo en equipo: nuestra patrulla favorita de cachorros Paw Patrol y el nuevo equipo de rescatistas multicolor Rainbow Rangers! ¿A quién verá tu peque? Descarga la app 👉📱https://goo.gl/A8pm8K iOS: https://goo.gl/obGlp5,Video,0.0,0.0,06/08/2019 08:00:01 AM, ,355,355,0,458,458,0,69,68,99,1,1,331,253,0,0,6,67,81,0,0,127,152,0,0,8611,17022,1.0,0.0,0.0,1.0,0.0,0.0,63.0,23.0,0.0,0.0,72.0,27.0,0.0,0.0,1.0,1.0,Latinoamérica,2019-06-08,8,Sábado,6,0.35774647887323946,0.0676056338028169
905878352825130_2240417886037830,https://www.facebook.com/NogginLA/posts/2240417886037830,"¿Qué es lo mejor de nuestro MEGA ESTRENO Rainbow Rangers? Cada una de las Rangers tiene un talento único que aporta al equipo, no solo para rescatar, sino también para ampliar la empatía y la compasión. ¡Si aún no tienes Noggin, descárgala ya!",Video,0.0,0.0,06/07/2019 08:00:02 AM, ,262,262,0,338,338,0,39,37,50,0,0,238,184,0,0,3,31,33,0,0,83,87,0,0,9723,30910,3.0,0.0,0.0,3.0,0.0,0.0,37.0,7.0,0.0,0.0,41.0,9.0,0.0,0.0,0.0,0.0,Latinoamérica,2019-06-07,8,Viernes,6,0.31679389312977096,0.03816793893129771
905878352825130_1023450517848511,https://www.facebook.com/NogginLA/videos/1023450517848511/,0,Video,0.0,0.0,06/01/2019 10:25:56 AM, ,251,251,0,322,322,0,385,384,539,0,0,52,29,0,0,35,65,82,0,0,307,400,0,0,34643,34643,2.0,0.0,0.0,2.0,0.0,0.0,384.0,26.0,0.0,0.0,511.0,28.0,0.0,0.0,0.0,0.0,Latinoamérica,2019-06-01,10,Sábado,6,1.2231075697211156,0.11155378486055777
905878352825130_2233298350083117,https://www.facebook.com/NogginLA/posts/2233298970083055:0,Noggin Latinoamérica,Photo,0.0,0.0,06/01/2019 10:18:07 AM, ,0,0,0,0,0,0,3,0,0,0,0,0,0,0,0,1,0,0,0,0,0,0,0,0,0,0,3.0,0.0,0.0,3.0,0.0,0.0,0.0,0.0,0.0,0.0,0.0,0.0,0.0,0.0,0.0,0.0,Latinoamérica,2019-06-01,10,Sábado,6,0.0,0.0
905878352825130_2216052448474374,https://www.facebook.com/NogginLA/posts/2216052448474374,"Todos los meses tenemos algo nuevo en Noggin. Desde temporadas completas, estrenos de series, canciones y juegos; las sorpresas no paran. Descarga la app y disfruta con tu peque una nueva forma de consumir y aprender online.",Video,0.0,0.0,05/31/2019 07:15:00 AM, ,281,281,0,378,378,0,48,46,70,0,0,266,190,0,0,12,49,55,0,0,87,99,0,0,5437,8810,2.0,0.0,0.0,2.0,0.0,0.0,39.0,22.0,0.0,0.0,44.0,26.0,0.0,0.0,0.0,0.0,Latinoamérica,2019-05-31,7,Viernes,5,0.3096085409252669,0.08540925266903915
905878352825130_2207713105974975,https://www.facebook.com/NogginLA/posts/2207713105974975,"Todos los meses tenemos algo nuevo en Noggin. Desde temporadas completas, estrenos de series, canciones y juegos; las sorpresas no paran. Descarga la app y disfruta con tu peque una nueva forma de consumir y aprender online.",Video,0.0,0.0,05/31/2019 07:00:00 AM, ,411,411,0,558,558,0,50,46,68,0,0,375,276,0,0,10,42,46,0,0,83,94,0,0,4466,8810,6.0,1.0,0.0,6.0,1.0,0.0,38.0,19.0,0.0,0.0,48.0,20.0,0.0,0.0,0.0,0.0,Latinoamérica,2019-05-31,7,Viernes,5,0.20194647201946472,0.06326034063260341
905878352825130_2207709159308703,https://www.facebook.com/NogginLA/posts/2207709159308703,Mayo es el mes para agradecer los cuidados de mamá y tenemos un especial increíble para tú y tus peques. Entérate haciendo clic en el post y descarga la app para celebrar en familia 👉📱https://goo.gl/A8pm8K iOS: https://goo.gl/obGlp5,Photo,0.0,0.0,05/24/2019 07:00:00 AM, ,2749,2749,0,3761,3761,0,391,389,410,0,0,3515,2563,0,0,362,0,0,0,0,0,0,0,0,0,0,15.0,1.0,1.0,15.0,1.0,1.0,0.0,15.0,6.0,381.0,0.0,16.0,6.0,388.0,0.0,0.0,Latinoamérica,2019-05-24,7,Viernes,5,0.0,0.013823208439432522
905878352825130_2214707595275526,https://www.facebook.com/NogginLA/posts/2214707595275526,Noggin Latinoamérica updated their website address.,Link,0.0,0.0,05/21/2019 11:06:51 AM, ,348,348,0,435,435,0,11,9,9,1,1,352,279,0,0,6,0,0,0,0,0,0,0,0,0,0,2.0,0.0,0.0,2.0,0.0,0.0,0.0,5.0,4.0,0.0,0.0,5.0,4.0,0.0,1.0,1.0,Latinoamérica,2019-05-21,11,Martes,5,0.0,0.031609195402298854
905878352825130_2207408522672100,https://www.facebook.com/NogginLA/posts/2207408522672100,"La seguridad de tu hijo es nuestra prioridad. Sin comerciales y con una plataforma certificada, garantizamos su protección.",Video,0.0,0.0,05/18/2019 07:00:00 AM, ,216957,661,216775,462493,878,461615,3560,3444,8133,0,0,9352,2518,9097,2363,60,49,53,5945,6667,142,188,45123,62164,3173,28435,190.0,26.0,4.0,200.0,26.0,5.0,3355.0,136.0,0.0,0.0,7969.0,164.0,0.0,0.0,0.0,0.0,Latinoamérica,2019-05-18,7,Sábado,5,0.0006545075752338021,0.0016408781463607997
905878352825130_2207405492672403,https://www.facebook.com/NogginLA/posts/2207405492672403,"Tenemos los mejores shows de Nick Jr., juegos y especiales para que tu peque aprenda mientras disfruta. ¡Descárgala ya!",Video,0.0,0.0,05/17/2019 07:47:36 AM, ,167989,1133,166848,331862,1492,330370,3466,3294,5095,0,0,2824,1303,2515,1110,48,90,109,10306,10859,273,329,58774,75559,3992,18985,209.0,35.0,9.0,218.0,36.0,12.0,3211.0,157.0,0.0,0.0,4923.0,172.0,0.0,0.0,0.0,0.0,Latinoamérica,2019-05-17,7,Viernes,5,0.0016251064057765687,0.0024406359940234183
905878352825130_2195757873837165,https://www.facebook.com/NogginLA/posts/2195757873837165,"La importancia de involucrarse y ayudar a nuestra comunidad y amigos es el mensaje más importante de Sunny Day, nuestro súper estreno del mes. ¡Descarga la app para disfrutarlo con tu peque!",Video,0.0,0.0,05/11/2019 06:00:00 AM, ,241,241,0,327,327,0,76,72,105,0,0,236,164,0,0,10,50,53,0,0,105,122,0,0,8158,18366,5.0,0.0,0.0,5.0,0.0,0.0,68.0,29.0,0.0,0.0,73.0,32.0,0.0,0.0,0.0,0.0,Latinoamérica,2019-05-11,6,Sábado,5,0.43568464730290457,0.14107883817427386
905878352825130_2195654820514137,https://www.facebook.com/NogginLA/posts/2195654820514137,¿Sabes de qué trata nuestro estreno del mes? Sunny Day es una chica dueña de su propio salón y con su talento de estilista resuelve miles de problemas. Es un modelo de buen liderazgo y de cómo mantenerse fiel a una misma para miles de niñas. ¡No se lo pierdan!,Video,0.0,0.0,05/10/2019 09:32:30 AM, ,242,242,0,335,335,0,46,44,67,0,0,242,169,0,0,6,30,36,0,0,71,85,0,0,9195,35305,2.0,0.0,1.0,2.0,0.0,1.0,38.0,22.0,0.0,0.0,43.0,24.0,0.0,0.0,0.0,0.0,Latinoamérica,2019-05-10,9,Viernes,5,0.29338842975206614,0.10330578512396695
905878352825130_2181902081889411,https://www.facebook.com/NogginLA/posts/2181902081889411,"Aparte del factor bilingüe, todas las temporadas de Dora la Exploradora trabajan el sentido de la ubicación a través de mapas, pistas y desafíos para los preescolares. ¡Descarga la app para disfrutarlo con tu peque!",Video,0.0,0.0,05/04/2019 06:00:01 AM, ,801,801,0,1053,1053,0,288,276,398,0,0,587,466,0,0,20,234,249,0,0,433,487,0,0,16482,25363,18.0,7.0,4.0,19.0,7.0,5.0,254.0,66.0,0.0,0.0,316.0,82.0,0.0,0.0,0.0,0.0,Latinoamérica,2019-05-04,6,Sábado,5,0.5405742821473158,0.11860174781523096
905878352825130_2181897768556509,https://www.facebook.com/NogginLA/posts/2181897768556509,Dora tiene una actitud proactiva y también es reflexiva y paciente. A menudo decide &quot;detenerse y pensar&quot; en un problema cuando no puede resolverlo de inmediato. No se pierdan la NUEVA TEMPORADA COMPLETA de Dora la Exploradora. ¡Descarga la app para disfrutarlo con tu peque!,Video,0.0,0.0,05/02/2019 07:48:00 AM, ,492,492,0,690,690,0,348,340,439,0,0,345,261,0,0,11,246,281,0,0,386,449,0,0,13806,18387,10.0,1.0,0.0,10.0,2.0,0.0,330.0,34.0,0.0,0.0,394.0,45.0,0.0,0.0,0.0,0.0,Latinoamérica,2019-05-02,7,Jueves,5,0.7845528455284553,0.09146341463414634
905878352825130_2172418216171131,https://www.facebook.com/NogginLA/posts/2172418216171131,"¿Puedes nombrar tu show favorito con emojis? Noggin pone a tu disposición los mejores contenidos de Nick Jr. con novedades cada mes, mega estrenos y especiales para que tu peque se eduque y entretenga. ¡Descárgala ya! Android: https://goo.gl/A8pm8K iOS: https://goo.gl/obGlp5",Video,0.0,0.0,04/27/2019 07:00:01 AM, ,544,544,0,758,758,0,55,50,80,0,0,538,396,0,0,22,30,33,0,0,112,123,0,0,6048,24190,6.0,1.0,0.0,6.0,1.0,0.0,35.0,31.0,1.0,0.0,39.0,40.0,1.0,0.0,0.0,0.0,Latinoamérica,2019-04-27,7,Sábado,4,0.20588235294117646,0.07169117647058823
905878352825130_2172339396179013,https://www.facebook.com/NogginLA/posts/2172339396179013,"Noggin está 100% pensado para el bienestar de los peques. Con contenido creado por expertos y una plataforma cerrada, somos una forma segura de monitorear la información digital que consume tu hijo #protegeatushijos 
Android: https://goo.gl/A8pm8K
iOS: https://goo.gl/obGlp5",Video,0.0,0.0,04/26/2019 08:28:04 AM, ,555,555,0,783,783,0,37,30,45,0,0,590,425,0,0,16,38,42,0,0,114,124,0,0,4852,13694,7.0,1.0,0.0,7.0,1.0,0.0,20.0,17.0,0.0,0.0,23.0,22.0,0.0,0.0,0.0,0.0,Latinoamérica,2019-04-26,8,Viernes,4,0.20540540540540542,0.04504504504504504
905878352825130_2158602790886007,https://www.facebook.com/NogginLA/posts/2158602790886007,"¿Qué valores comunica Nella la Princesa Valiente a tu peque? Autoconfianza, inclusión y que lo importante es disfrutar del proceso de sortear los distintos obstáculos que se te presentan. Descarga la app 👉📱 Android: https://goo.gl/A8pm8K iOS: https://goo.gl/obGlp5",Video,0.0,0.0,04/20/2019 07:00:01 AM, ,367,367,0,513,513,0,46,43,84,0,0,387,271,0,0,9,36,37,0,0,78,96,0,0,5829,18387,1.0,1.0,0.0,1.0,1.0,0.0,40.0,16.0,0.0,0.0,55.0,29.0,0.0,0.0,0.0,0.0,Latinoamérica,2019-04-20,7,Sábado,4,0.2125340599455041,0.04904632152588556
905878352825130_2158600617552891,https://www.facebook.com/NogginLA/posts/2158600617552891,¿Buscas entretenimiento educativo para tu peque? Rusty Rivets presenta las técnicas básicas del proceso de ingeniería para preescolares - lo justo para sembrar un interés. ¡Descarga Noggin y disfruta de las mejores series de Nick Jr sin publicidad! Android: https://goo.gl/A8pm8K iOS: https://goo.gl/obGlp5,Video,0.0,0.0,04/19/2019 07:00:00 AM, ,438,438,0,612,612,0,46,41,71,0,0,431,303,0,0,12,35,41,0,0,98,106,0,0,5426,16338,2.0,2.0,0.0,2.0,2.0,0.0,37.0,18.0,1.0,0.0,45.0,25.0,1.0,0.0,0.0,0.0,Latinoamérica,2019-04-19,7,Viernes,4,0.2237442922374429,0.05251141552511415
905878352825130_2150540631692223,https://www.facebook.com/NogginLA/posts/2150540631692223,"¡Llega Semana Santa y con ella el especial Cuentos de Pascua! Blaze, Paw Patrol y Team Umizoomi necesitarán la ayuda de tu peque para encontrar los huevos de pascuas y otros dulces festivos. ¡Descarga Noggin y obtén 7 días gratis! Android: https://goo.gl/A8pm8K iOS: https://goo.gl/obGlp5",Video,0.0,0.0,04/13/2019 06:00:16 AM, ,342,342,0,471,471,0,42,39,118,0,0,332,258,0,0,10,39,54,0,0,81,110,0,0,8522,15635,6.0,0.0,0.0,6.0,0.0,0.0,34.0,15.0,0.0,0.0,97.0,21.0,0.0,0.0,0.0,0.0,Latinoamérica,2019-04-13,6,Sábado,4,0.23684210526315788,0.06140350877192982
905878352825130_2150531545026465,https://www.facebook.com/NogginLA/posts/2150531545026465,"Nella la Princesa Valiente es una princesa dedicada a actividades reales y se transforma cuando ella o sus amigos se encuentran en problemas. Su mensaje es excelente para niños porque les recuerda que no estamos definidos por cómo nos vemos, sino por lo que creemos que podemos hacer.",Video,0.0,0.0,04/12/2019 09:47:52 AM, ,319,319,0,434,434,0,43,42,101,0,0,298,227,0,0,12,37,46,0,0,68,92,0,0,6325,15379,2.0,0.0,0.0,2.0,0.0,0.0,42.0,7.0,0.0,0.0,87.0,14.0,0.0,0.0,0.0,0.0,Latinoamérica,2019-04-12,9,Viernes,4,0.21316614420062696,0.02821316614420063
905878352825130_2138116199601333,https://www.facebook.com/NogginLA/posts/2138116199601333,"¡Llegó Nella la Princesa Valiente, el mega estreno del mes! Descarga la serie que cambiará el mundo de las princesas para siempre 👑🗡💖🛡. Encuéntrala y disfrútala offline con tu peque 🤳

Android: https://goo.gl/A8pm8K 
iOS: https://goo.gl/obGlp5",Video,0.0,0.0,04/05/2019 07:50:00 AM, ,374,374,0,491,491,0,130,127,219,0,0,263,212,0,0,8,76,84,0,0,154,191,0,0,14182,30377,4.0,1.0,0.0,5.0,1.0,0.0,123.0,18.0,0.0,0.0,178.0,41.0,0.0,0.0,0.0,0.0,Latinoamérica,2019-04-05,7,Viernes,4,0.4117647058823529,0.06149732620320856
905878352825130_2138107082935578,https://www.facebook.com/NogginLA/posts/2138107082935578,¡Tenemos una nueva temporada completa de Pistas de Blue! ¿Lo conoces? Es el show que revolucionó el género de serie animada educativa al invitar a sus espectadores a participar. ¡Descarga la app de Noggin para que tu peque obtenga este beneficio!,Video,0.0,0.0,04/04/2019 08:34:39 AM, ,401,401,0,545,545,0,244,238,313,0,0,314,227,0,0,13,173,210,0,0,286,340,0,0,13032,18643,8.0,1.0,0.0,9.0,2.0,0.0,235.0,24.0,0.0,0.0,286.0,27.0,0.0,0.0,0.0,0.0,Latinoamérica,2019-04-04,8,Jueves,4,0.713216957605985,0.08229426433915212
905878352825130_2133377510075202,https://www.facebook.com/NogginLA/posts/2133378240075129:0,Noggin Latinoamérica,Photo,0.0,0.0,04/01/2019 07:48:17 AM, ,9,9,0,10,10,0,24,8,12,0,0,3,2,0,0,9,0,0,0,0,0,0,0,0,0,0,14.0,0.0,2.0,22.0,0.0,2.0,0.0,0.0,0.0,8.0,0.0,0.0,0.0,12.0,0.0,0.0,Latinoamérica,2019-04-01,7,Lunes,4,0.0,1.7777777777777777
905878352825130_2128571497222470,https://www.facebook.com/NogginLA/posts/2128571497222470,"Los Chocolix es nuestra nueva serie. Trae interesantes relatos de familia y muuuuuchas choco canciones para bailar con tus peques ¡Descarga Noggin ya! 
Android: https://goo.gl/A8pm8K 
iOS: https://goo.gl/obGlp5",Video,0.0,0.0,03/31/2019 06:00:00 AM, ,630,630,0,838,838,0,83,75,177,0,0,681,530,0,0,17,26,33,0,0,133,182,0,0,11174,56297,6.0,2.0,0.0,6.0,2.0,0.0,68.0,18.0,0.0,0.0,141.0,36.0,0.0,0.0,0.0,0.0,Latinoamérica,2019-03-31,6,Domingo,3,0.2111111111111111,0.04126984126984127
905878352825130_2128560307223589,https://www.facebook.com/NogginLA/posts/2128560307223589,Aprendizajes cargados de aventura de la mano de Paw Patrol + Blaze and the Monster Machines llegaron a Noggin. Muchas lecciones de STEM y desarrollo social para tu peque. ¡Aprovecha los 7 días gratis y descárgala ya! Android: https://goo.gl/A8pm8K iOS: https://goo.gl/obGlp5,Video,0.0,0.0,03/29/2019 08:00:01 AM, ,726,726,0,975,975,0,324,319,574,0,0,776,587,0,0,28,303,441,0,0,397,577,0,0,9983,9983,15.0,1.0,0.0,18.0,1.0,0.0,307.0,29.0,2.0,0.0,532.0,40.0,2.0,0.0,0.0,0.0,Latinoamérica,2019-03-29,8,Viernes,3,0.546831955922865,0.06473829201101929
905878352825130_2118249668254653,https://www.facebook.com/NogginLA/posts/2118249668254653,"¡Llegó el postre! Chocolix, el show más dulce y familiero de Nick Jr. que tu peque podrá disfrutar sin comerciales, cuando y donde quiera. ¡Descarga Noggin ya! Android: https://goo.gl/A8pm8K iOS: https://goo.gl/obGlp5",Video,0.0,0.0,03/23/2019 07:00:01 AM, ,355,355,0,530,530,0,36,36,77,0,0,373,258,0,0,13,23,24,0,0,88,104,0,0,4371,12478,0.0,0.0,0.0,0.0,0.0,0.0,30.0,19.0,0.0,0.0,51.0,26.0,0.0,0.0,0.0,0.0,Latinoamérica,2019-03-23,7,Sábado,3,0.24788732394366197,0.05352112676056338
905878352825130_2118315324914754,https://www.facebook.com/NogginLA/posts/2118315324914754,"Con altas expectativas, iniciativa y proactividad, el personaje de Skye de Paw Patrol es un modelo a seguir para miles de niñas. Encuentra los especiales de Paw Patrol en Noggin. ¡Descárgala ya! Android: https://goo.gl/A8pm8K iOS: https://goo.gl/obGlp5",Video,0.0,0.0,03/22/2019 12:22:37 PM, ,535,535,0,746,746,0,463,457,633,0,0,287,186,0,0,21,294,330,0,0,539,647,0,0,18368,26025,9.0,2.0,0.0,9.0,2.0,0.0,448.0,39.0,1.0,0.0,563.0,69.0,1.0,0.0,0.0,0.0,Latinoamérica,2019-03-22,12,Viernes,3,1.0074766355140188,0.09532710280373832
905878352825130_2108206655925621,https://www.facebook.com/NogginLA/posts/2108206655925621,Tenemos entretenimiento que enseña: Paw Patrol y Blaze and the Monster Machines llegaron con su dinamismo y formato interactivo para mostrarle a tu peque lecciones de trabajo en equipo. ¡Suscríbete ya! Android: https://goo.gl/A8pm8K iOS: https://goo.gl/obGlp5,Video,0.0,0.0,03/16/2019 08:00:17 AM, ,1728,1728,0,2358,2358,0,861,832,1484,1,1,1932,1474,0,0,64,776,1133,0,0,1036,1544,0,0,13459,13459,33.0,3.0,0.0,37.0,3.0,0.0,807.0,80.0,5.0,0.0,1355.0,124.0,5.0,0.0,1.0,1.0,Latinoamérica,2019-03-16,8,Sábado,3,0.5995370370370371,0.07002314814814815
905878352825130_2108205592592394,https://www.facebook.com/NogginLA/posts/2108205592592394,Tenemos unas chocolatosas novedades...¡Descarga la app para disfrutar de nuevos sabores y aventuras!,Video,0.0,0.0,03/15/2019 10:55:00 AM, ,302,302,0,440,440,0,30,27,89,0,0,314,218,0,0,7,15,23,0,0,60,91,0,0,7503,22526,4.0,0.0,0.0,4.0,0.0,0.0,24.0,11.0,0.0,0.0,70.0,19.0,0.0,0.0,0.0,0.0,Latinoamérica,2019-03-15,10,Viernes,3,0.1986754966887417,0.04966887417218543
905878352825130_2089493151130305,https://www.facebook.com/NogginLA/posts/2089493151130305,"Noggin es la plataforma con los shows más apasionantes y anticipados por tus hijos. ¡Desde el inicio hasta el final, tú y tus hijos no podrán dejar de cantar! ¿Qué esperas para descargar la app? Android: https://goo.gl/A8pm8K iOS: https://goo.gl/obGlp5",Video,0.0,0.0,03/09/2019 05:00:02 AM, ,767,767,0,1054,1054,0,140,136,305,0,0,527,389,0,0,21,97,112,0,0,246,305,0,0,15772,40363,6.0,2.0,2.0,7.0,2.0,2.0,117.0,43.0,1.0,0.0,226.0,78.0,1.0,0.0,0.0,0.0,Latinoamérica,2019-03-09,5,Sábado,3,0.32073011734028684,0.07040417209908735
905878352825130_2089476234465330,https://www.facebook.com/NogginLA/posts/2089476234465330,¿Una app de streaming para que tus peques puedan disfrutar de Blaze y los Monster Machines + lo mejor de Nick Jr. sin comerciales? ¡Suscríbete ya! Android: https://goo.gl/A8pm8K iOS: https://goo.gl/obGlp5,Video,0.0,0.0,03/08/2019 07:00:02 AM, ,707,707,0,957,957,0,321,319,527,0,0,302,219,0,0,13,118,148,0,0,359,437,0,0,50904,96105,11.0,0.0,0.0,13.0,0.0,0.0,306.0,85.0,0.0,0.0,421.0,106.0,0.0,0.0,0.0,0.0,Latinoamérica,2019-03-08,7,Viernes,3,0.5077793493635078,0.13578500707213578
905878352825130_2089140044498949,https://www.facebook.com/NogginLA/posts/2089140424498911:0,Noggin Latinoamérica,Photo,0.0,0.0,03/01/2019 07:27:06 AM, ,1,1,0,3,3,0,11,8,17,0,0,3,1,0,0,2,0,0,0,0,0,0,0,0,0,0,4.0,0.0,2.0,4.0,0.0,3.0,0.0,0.0,0.0,8.0,0.0,0.0,0.0,17.0,0.0,0.0,Latinoamérica,2019-03-01,7,Viernes,3,0.0,6.0
905878352825130_2083336461745974,https://www.facebook.com/NogginLA/posts/2083336461745974,"No solo son los umi-amigos de tus peques, Team Umizoomi también los ayudan a resolver problemas matemáticos 🧮💯 con su formato interactivo. Todo el entretenimiento que enseña encuéntralo en Noggin, la app de Nick Jr. ¡Descárgala en la App Store o Google Play!",Video,0.0,0.0,02/28/2019 06:59:00 AM, ,354,354,0,522,522,0,1,1,1,0,0,403,279,0,0,1,0,0,0,0,3,3,0,0,4424,28542,0.0,0.0,0.0,0.0,0.0,0.0,0.0,1.0,0.0,0.0,0.0,1.0,0.0,0.0,0.0,0.0,Latinoamérica,2019-02-28,6,Jueves,2,0.00847457627118644,0.002824858757062147
905878352825130_2083325805080373,https://www.facebook.com/NogginLA/posts/2083325805080373,En Noggin celebramos las matemáticas con desafíos y especiales con valores STEM para que los niños en edad preescolar den sus primeros pasos hacia esas ramas. Descarga la app 👉📱para disfrutar el especial MUNDO DEL CONOCIMIENTO.,Photo,0.0,0.0,02/26/2019 06:56:00 AM, ,963,963,0,1229,1229,0,30,26,35,0,0,695,537,0,0,8,0,0,0,0,0,0,0,0,0,0,4.0,1.0,2.0,4.0,1.0,2.0,0.0,4.0,0.0,22.0,0.0,4.0,0.0,31.0,0.0,0.0,Latinoamérica,2019-02-26,6,Martes,2,0.0,0.01142263759086189
905878352825130_2083327118413575,https://www.facebook.com/NogginLA/posts/2083327118413575,"Blaze y los Monster Machines, Rusty Rivets, Team Umizoomi y muchos más se unieron para compartir con tu hijo lecciones sobre ciencia, tecnología, física y matemáticas. Descarga los episodios para disfrutarlos offline ⚡️💯",Video,0.0,0.0,02/25/2019 06:59:00 AM, ,426,426,0,625,625,0,96,95,146,1,1,379,295,0,0,13,87,111,0,0,145,180,0,0,11276,13481,2.0,1.0,0.0,3.0,1.0,0.0,89.0,22.0,0.0,0.0,115.0,31.0,0.0,0.0,1.0,1.0,Latinoamérica,2019-02-25,6,Lunes,2,0.3403755868544601,0.05868544600938967
905878352825130_2061214803958140,https://www.facebook.com/NogginLA/posts/2061214803958140,"La educación es obsoleta sin interacción. Nuestro contenido es desarrollado por especialistas para despertar interés en tecnología, matemáticas e idiomas en los preescolares de hoy. No te pierdas el especial Mundo del Conocimiento. ¡Descárgate la app ya!",Video,0.0,0.0,02/16/2019 06:00:01 AM, ,401,401,0,603,603,0,33,30,44,0,0,397,300,0,0,9,15,15,0,0,73,87,0,0,5405,36286,5.0,0.0,0.0,5.0,0.0,0.0,29.0,8.0,0.0,0.0,36.0,8.0,0.0,0.0,0.0,0.0,Latinoamérica,2019-02-16,6,Sábado,2,0.18204488778054864,0.032418952618453865
905878352825130_2061212393958381,https://www.facebook.com/NogginLA/posts/2061212393958381,Funcional y entretenido. El mundo de Noggin tiene las puertas abiertas para que tus hijos disfruten y aprendan con el mejor contenido de Nick Jr. Descarga la app y compruébalo por ti mismo.,Video,0.0,0.0,02/15/2019 05:00:01 AM, ,424,424,0,617,617,0,50,48,84,0,0,437,334,0,0,13,38,44,0,0,103,122,0,0,4248,9706,4.0,0.0,0.0,4.0,0.0,0.0,46.0,14.0,0.0,0.0,67.0,17.0,0.0,0.0,0.0,0.0,Latinoamérica,2019-02-15,5,Viernes,2,0.2429245283018868,0.04245283018867924
905878352825130_2055335674546053,https://www.facebook.com/NogginLA/posts/2055335674546053,Febrero viene potenciado ya que tenemos un especial increíble para tus peques. Entérate haciendo clic en el post y descarga la app para disfrutarlos 👉📱,Photo,0.0,0.0,02/09/2019 05:00:01 AM, ,1168,1168,0,1565,1565,0,43,33,40,0,0,1421,1086,0,0,35,0,0,0,0,0,0,0,0,0,0,13.0,1.0,0.0,13.0,1.0,0.0,0.0,6.0,0.0,28.0,0.0,6.0,0.0,34.0,0.0,0.0,Latinoamérica,2019-02-09,5,Sábado,2,0.0,0.017123287671232876
905878352825130_2055333974546223,https://www.facebook.com/NogginLA/posts/2055333974546223,Rusty Rivets motiva a los preescolares a inventar soluciones creativas a través de la ingeniería y la ciencia. ¡No te pierdas los otros episodios educativos del especial Mundo del Conocimiento descargando la app 👉📱!,Video,0.0,0.0,02/08/2019 07:00:01 AM, ,579,579,0,839,835,0,361,357,567,0,0,492,365,0,0,20,258,303,0,0,435,576,0,0,31186,39550,10.0,0.0,0.0,10.0,0.0,0.0,344.0,51.0,0.0,0.0,490.0,77.0,0.0,0.0,0.0,0.0,Latinoamérica,2019-02-08,7,Viernes,2,0.7512953367875648,0.10535405872193437
905878352825130_2046911795388441,https://www.facebook.com/NogginLA/posts/2046911795388441,"Noggin es la app preferida de los padres que tienen hijos en edad preescolar. Descubre los shows y juegos de Nick Jr., libres de publicidad y con opción para disfrutarlos sin consumo de datos. ¡Descarga la app ya 👉📱!",Video,0.0,0.0,02/02/2019 05:00:00 AM, ,503,503,0,733,733,0,68,65,116,0,0,510,393,0,0,22,28,33,0,0,98,132,0,0,9970,35113,6.0,0.0,1.0,6.0,0.0,1.0,58.0,18.0,0.0,0.0,97.0,19.0,0.0,0.0,0.0,0.0,Latinoamérica,2019-02-02,5,Sábado,2,0.19483101391650098,0.04970178926441352
905878352825130_1993704334264809,https://www.facebook.com/NogginLA/videos/1993704334264809/,0,Video,0.0,0.0,02/01/2019 08:08:07 AM, ,101,101,0,192,192,0,20,19,25,0,0,38,29,0,0,7,2,2,0,0,27,28,0,0,12052,30505,3.0,0.0,0.0,4.0,0.0,0.0,19.0,4.0,0.0,0.0,21.0,4.0,0.0,0.0,0.0,0.0,Latinoamérica,2019-02-01,8,Viernes,2,0.26732673267326734,0.06930693069306931
905878352825130_2046537165425904,https://www.facebook.com/NogginLA/posts/2046537582092529:0,Noggin Latinoamérica,Photo,0.0,0.0,02/01/2019 08:03:36 AM, ,0,0,0,0,0,0,12,9,13,0,0,0,0,0,0,2,0,0,0,0,0,0,0,0,0,0,4.0,0.0,0.0,4.0,0.0,0.0,0.0,0.0,0.0,9.0,0.0,0.0,0.0,13.0,0.0,0.0,Latinoamérica,2019-02-01,8,Viernes,2,0.0,0.0
